{
  "schema_version": "1.0",
  "created_at": "2026-08-06T17:51:33+00:00",
  "source_hashes": {
    "source-20260806164901538979-1b9c0af0@2": "eca695af1eaccb27d3201d9289f6074b608982eff0085decccd02b695a40cdc0",
    "source-20260806164901548194-b740679c@2": "847f2f073c7b8bcb5b28a1335cab74001c0c609cec5c5234a47b8cd53cf4b678",
    "source-20260806164901555123-5d128edc@2": "b381f8492b600734b6010e0347792f27d0b941c7bca19629701401bb75b9781c",
    "source-20260806164350224713-c472f161@1": "7ed6b57da1d79243dffce17067941b2bc6aa0e6e143477446b8ec3616dc4334d",
    "source-20260806164901561956-78c1630f@2": "4d69ce16fb9b8e5203e56bf4a32d16dbad84137b782dc67fa38c633f9fcb9a7d",
    "source-20260806164901567766-370d2686@2": "52888a8ded606434deb09a756612013967873b6b44ab0bd58056721add8f1f53",
    "source-20260806164901573671-84f52e1f@2": "6dba651e8aa6229b9e18f8c1dcbeac07e33364408a13eec4876b4825b6144b48"
  },
  "protected": [
    "source_facts",
    "authorization",
    "safety_boundaries",
    "negative_tests",
    "canonical_evals"
  ],
  "canonical_eval_hashes": {},
  "runtime_eval_hashes": {},
  "source_quality_hash": "0fb271f012cbb35922a5db6a039fb662b87418fa0147bf092b75d09ea6300aa9"
}
