{
  "schema_version": "1.0",
  "created_at": "2026-08-06T04:16:31+00:00",
  "source_hashes": {
    "source-20260806041631479977-712eb5f9@1": "0b885869848cc7f96c403f4599939e4fabf65e9076038e95997df31ffaf8bd7a",
    "source-20260806041631502609-d57c3f97@1": "f5f1d2b8bca486edd5623267349b21e882bc65a7373e18942208b81f38f8250f",
    "source-20260806041631511513-111e5cbb@1": "ed210ea6aff48e32bd703c9aaa766399200a8c9d60e1b6f568a5f4947ca7f153",
    "source-20260806041631516587-14231a7e@1": "a58d05e75a318bdd6f7f603ebe90f9ab7142a7fa366f63bcf47b12096b4700e1"
  },
  "protected": [
    "source_facts",
    "authorization",
    "safety_boundaries",
    "negative_tests",
    "canonical_evals"
  ],
  "canonical_eval_hashes": {},
  "runtime_eval_hashes": {},
  "source_quality_hash": "2afe8dad1ea5cc5e37d26a54e6697058e9c46d6c270d7171c68b0f4a7c2ce4c9"
}
